{
  "contract_name": "helper.result",
  "contract_version": "1.0.0",
  "schema_version": "1.0.0",
  "taxonomy_version": "taxonomy-reason-v1",
  "tenant_id": "tenant-lab-001",
  "customer_context_id": "customer-context-main",
  "environment": "phase0_lab",
  "correlation_id": "corr-office-helper-001",
  "causation_id": "helper-assignment-001",
  "idempotency_key": "idem-helper-result-001",
  "producer": {"component": "supervisor", "produced_at": "2026-09-07T15:00:01Z"},
  "policy_version": "policy-office-helper-lab-v1",
  "helper_result_id": "helper-result-001",
  "assignment_id": "helper-assignment-001",
  "request_id": "helper-request-001",
  "helper_scope_id": "helper-scope-office-operations-001",
  "helper_agent_id": "office-operations-helper-001",
  "helper_role": "office_operations_helper",
  "review_type": "registration_sop_review",
  "scenario_id": "missing-phone",
  "status": "completed",
  "disposition": "needs_human_input",
  "reason_codes": ["helper_review_completed", "helper_human_input_required"],
  "findings": [{"field": "phone", "status": "NEEDS_HUMAN_INPUT", "reason_code": "missing_value"}],
  "recommendations": ["Request the missing phone value from a human; do not invent it.", "Keep external submission blocked until the owner reviews the prepared form."],
  "proposed_task_steps": ["Review the fixed synthetic scenario against the registration SOP.", "Resolve every NEEDS_HUMAN_INPUT field with an attended human decision.", "Present the prepared form for owner review without submitting it."],
  "guardian_decision_id": "gd-office-helper-001",
  "pre_action_evidence_ref": "harness-event:helper-request-001",
  "post_action_evidence_ref": "harness-event:helper-result-001",
  "human_review_required": true,
  "synthetic_data_only": true,
  "deterministic_review": true,
  "raw_profile_included": false,
  "model_called": false,
  "tools_used": false,
  "memory_used": false,
  "approval_requested": false,
  "arc_dispatched": false,
  "connector_accessed": false,
  "submission_allowed": false,
  "external_side_effects": false,
  "created_at": "2026-09-07T15:00:00Z",
  "completed_at": "2026-09-07T15:00:01Z"
}
